{
  "caseId": "live.production.external-gate",
  "selectedSkill": "cineweave-production",
  "route": "execution_request",
  "outcome": "clarify",
  "contractKinds": ["cineweave_execution_request"],
  "response": "当前执行请求必须保持 blocked：RenderPlan、PromptRecord、AdapterDescriptor 和 CapabilityProfile 都缺少精确版本与 contentHash，预算 maxAmount 未定义，也没有绑定该 ExecutionRequest 本身的审批。补齐这些信息前阻断外部执行；审批其他上游资产不能替代对精确请求哈希的审批。",
  "questions": [
    "请提供四个输入工件的精确版本和 contentHash。",
    "本次最大金额、币种、尝试次数和最长执行时间是多少？",
    "由谁审批存储后的精确 ExecutionRequest？"
  ],
  "unsupportedClaims": []
}
